{
  "statement": "Long-polling for events never delays unrelated requests.",
  "status": "supported",
  "evidence": [
    "crates/axo-ipc/src/server.rs",
    "crates/axod/tests/rpc.rs#long_polls_never_delay_unrelated_requests"
  ],
  "epistemic": "stated",
  "about": [
    "actors/axod",
    "flows/event-subscription"
  ]
}
