{
  "statement": "The repository includes an Axo model snapshot at commit 4b82070 as a renderer example, describing a macOS terminal workspace with a Rust daemon and optional Cloudflare remote access.",
  "status": "supported",
  "epistemic": "stated",
  "note": "The sample is data presented by the generic renderer; it is not the Axo runtime bundled into Feynman.",
  "evidence": ["examples/axo/model/meta.json", "examples/axo/model/actors/axo-macos-app.json", "examples/axo/model/flows/daemon-startup.json", "examples/axo/model/protocols/local-rpc.json", "examples/axo/model/coverage/session-01a17119.json", "examples/axo/model/actors/axo-api-smoke-client.json", "examples/axo/model/actors/axo-cloud-api.json", "examples/axo/model/actors/axo-mac-packager.json", "examples/axo/model/actors/axo-mac-test-host.json", "examples/axo/model/actors/axo-pi-bridge.json", "examples/axo/model/actors/axo-public-site.json", "examples/axo/model/actors/axo-web-client.json", "examples/axo/model/actors/axod-cli.json", "examples/axo/model/actors/axod-daemon.json", "examples/axo/model/actors/axod-loadtest.json", "examples/axo/model/actors/ghostty-kit.json", "examples/axo/model/flows/api-smoke-client.json", "examples/axo/model/flows/app-daemon-self-test.json", "examples/axo/model/flows/catalog-sync.json", "examples/axo/model/flows/cloudflare-login.json", "examples/axo/model/flows/daemon-load-test.json", "examples/axo/model/flows/embedded-terminal-surface.json", "examples/axo/model/flows/host-pairing.json", "examples/axo/model/flows/mac-app-packaging.json", "examples/axo/model/flows/pi-auto-recovery.json", "examples/axo/model/flows/pi-bridge-session.json", "examples/axo/model/flows/remote-host-command.json", "examples/axo/model/flows/remote-terminal-stream.json", "examples/axo/model/flows/terminal-attach.json", "examples/axo/model/protocols/axo-state-contracts.json", "examples/axo/model/protocols/host-pairing-http.json", "examples/axo/model/protocols/host-relay.json", "examples/axo/model/protocols/pi-bridge.json", "examples/axo/model/protocols/public-site-routing.json", "examples/axo/model/protocols/terminal-attachment.json", "examples/axo/model/invariants/browser-pi-history-readonly.json", "examples/axo/model/invariants/mac-app-publication.json", "examples/axo/model/invariants/pi-bridge-binding-and-takeover.json", "examples/axo/model/invariants/pty-output-pump.json", "examples/axo/model/invariants/remote-session-privacy.json", "examples/axo/model/invariants/shell-close-confirmation.json", "examples/axo/model/invariants/sidebar-rename-bounds.json", "examples/axo/model/invariants/standalone-session-preservation.json", "examples/axo/model/invariants/subscriber-lag-resynchronization.json", "examples/axo/model/invariants/terminal-clipboard-consent.json", "examples/axo/model/invariants/untrusted-terminal-links.json", "examples/axo/model/limits/client-viewport.json", "examples/axo/model/limits/command-line-parsing.json", "examples/axo/model/limits/daemon-file-descriptors.json", "examples/axo/model/limits/daemon-log-rotation.json", "examples/axo/model/limits/layout-tree-size.json", "examples/axo/model/limits/load-test-heavy-p99.json", "examples/axo/model/limits/load-test-smoke-p99.json", "examples/axo/model/limits/main-thread-frame-budget.json", "examples/axo/model/limits/main-thread-stall-report-threshold.json", "examples/axo/model/limits/oauth-provider-response.json", "examples/axo/model/limits/pending-pane-progress-delay.json", "examples/axo/model/limits/pi-bridge-record.json", "examples/axo/model/limits/pi-event-data.json", "examples/axo/model/limits/pty-output-buffers.json", "examples/axo/model/limits/surface-reattach-interval.json", "examples/axo/model/limits/terminal-accessibility-text.json", "examples/axo/model/limits/terminal-scroll-sensitivity.json", "examples/axo/model/limits/ui-test-automation.json", "examples/axo/model/state/account-auth-and-pairing.json", "examples/axo/model/state/app-workbench.json", "examples/axo/model/state/axod-pane-lifecycle.json", "examples/axo/model/state/host-directory-snapshots.json", "examples/axo/model/state/pi-event-history.json"],
  "about": ["actors/model-renderer", "protocols/model-files"]
}
