{
  "statement": "A single PTY read larger than roughly 48 KiB becomes a terminal.output frame above the 65,536-byte relay limit; send_json rejects it and the relay session ends and reconnects.",
  "status": "unverified",
  "epistemic": "inferred",
  "note": "PTY reads up to 64 KiB; base64 adds a third. The input direction is capped at 49,152 bytes for exactly this reason, but no output chunking was found.",
  "evidence": [
    "crates/axo-pty/src/output.rs#READ_BUFFER_BYTES",
    "crates/axo-relay/src/relay.rs#send_json",
    "crates/axo-server/src/session.rs#write_terminal_input"
  ],
  "about": [
    "actors/axod",
    "actors/account-do",
    "flows/relay-connection"
  ]
}
