{
  "statement": "Shells keep running and producing output when no client is attached.",
  "status": "supported",
  "evidence": [
    "crates/axo-pty/src/output.rs",
    "crates/axod/tests/rpc.rs#terminal_attachments_share_output_and_shells_never_stall_unattached"
  ],
  "epistemic": "stated",
  "about": [
    "actors/axod",
    "flows/terminal-attach"
  ]
}
