{
  "statement": "A daemon restart restores each Pi conversation against its own exact transcript and never replays prompts or shell input.",
  "status": "supported",
  "evidence": [
    "crates/axo-server/src/session.rs#restart_unavailable_pi",
    "crates/axo-pi/src/history.rs",
    "docs/rfds/RFD0014-workspaces-and-agent-led-sessions.md"
  ],
  "epistemic": "stated",
  "about": [
    "actors/axod",
    "actors/pi",
    "flows/pi-recovery"
  ]
}
