{
  "statement": "Cloudflare OAuth tokens are never given to axod or browser JavaScript.",
  "status": "supported",
  "evidence": [
    "packages/axo-api-worker/src/auth/cloudflare.ts",
    "docs/rfds/RFD0013-cloudflare-oauth-and-host-pairing.md",
    "packages/axo-api-worker/tests/auth.test.ts"
  ],
  "epistemic": "stated",
  "about": [
    "actors/api-worker",
    "flows/web-sign-in"
  ]
}
